número|invitado|título|fecha|url_mp3|temas
1|Diego Cisneros|Nadar, Pedalear, Correr… y No Rendirse|2024-10-10|https://pub-588137ed925246f1a847e7b1a862df78.r2.dev/elgritcast-ep-001-diego-cisneros-ID3.MP3|Triatlón, Correr, Competencia
2|Lilia Freitas|Superviviente del Cáncer nos cuenta su motivadora historia|2024-10-17|https://pub-588137ed925246f1a847e7b1a862df78.r2.dev/elgritcast-ep-002-lilia-freitas-ID3.MP3|Cáncer, Resiliencia
3|José Manuel Rodríguez|Crítica literaria y pasión por el arte|2024-10-24|https://pub-588137ed925246f1a847e7b1a862df78.r2.dev/elgritcast-ep-003-jose-manuel-rodriguez-ID3.MP3|Literatura, Gabriel García Márquez
4|José Luís Rodríguez|El UTMB: “No hay otra carrera con ese nivel”.|2024-10-31|https://pub-588137ed925246f1a847e7b1a862df78.r2.dev/elgritcast-ep-004-jose-luis-rodriguez-ID3.MP3|Trailrunning, Ultra maratón, Montaña
5|Mayra Santos|¿Te has preguntado cómo alguien sobrevive 31 horas nadando sin parar?|2024-11-07|https://pub-588137ed925246f1a847e7b1a862df78.r2.dev/elgritcast-ep-005-mayra-santos-ID3.MP3|Open Water Swimming, Grit, Guinness
